{
    "access_token": "G5kXH2wHvUra0sHlDy1iTkDJgsgUO1bN",
    "token_type": "Bearer",
    "refresh_token": "4bwc0ESC_IAhflf-ACC_vjD_ltc11ne-8gFPfA2Kx16",
    "expires_in": 3600,
    "id_token": "eyJhbGciOiJSUzI1NiIsImtpZCI6IjE2NzcyNiJ9.eyJpc3MiOiJodHRwczovL3NlcnZlci5leGFtcGxlLmNvbSIsInN1YiI6IjI0ODI4OTc2MTAwMSIsImF1ZCI6InM2QmhkUmtxdDMiLCJlbWFpbCI6ImphbmVkb2VAZXhhbXBsZS5jb20iLCJleHAiOjE1Mzc4MTk4MDMsImlhdCI6MTUzNzgxOTUwM30.aVq83mdy72ddIFVJLjlNBX-5JHbjmwK-Sn9Mir-blesfYMceIOw6u4GOrO_ZroDnnbJXNKWAg_dxVynvMHnk3uJc46feaRIL4zfHf6Anbf5_TbgMaVO8iczD16A5gNjSD7yenT5fslrrW-NU_vtmi0s1puoM4EmSaPXCR19vRJyWuStJiRHK5yc3BtBlQ2xwxH1iNP49rGAQe_LHfW1G74NY5DaPv-V23JXDNEIUTY-jT-NbbtNHAxnhNPyn8kcO2WOoeIwANO9BfLF1EFWtjGPPMj6kDVrikec47yK86HArGvsIIwk1uExynJIv_tgZGE0eZI7MtVb2UlCwDQrVlg"
}